{
  "schema_version": 1,
  "kit_version": "1.0.1",
  "managed": [
    {
      "path": ".agents/skills/ishiku-design-review/agents/openai.yaml",
      "sha256": "3dbac0074cde4c8f47a9179a4ffd16c5d217a6f9b2692c436ba396cb88f71071"
    },
    {
      "path": ".agents/skills/ishiku-design-review/SKILL.md",
      "sha256": "601a715fc3c384661ef88ab2a75e23688ecbe13fa64590223f928dd0f1d707cf"
    },
    {
      "path": ".agents/skills/ishiku-docker-review/agents/openai.yaml",
      "sha256": "9b30bc0213d28bbe9c081ddf87a2e4779d4ead75a1cfee8b78ead25cd1a5bc3e"
    },
    {
      "path": ".agents/skills/ishiku-docker-review/SKILL.md",
      "sha256": "c3be3260a0573d1bd2c0c73c2e7a5e1637d9da9edb482bb11de6192115ed2eae"
    },
    {
      "path": ".agents/skills/ishiku-github-release/agents/openai.yaml",
      "sha256": "127826d4a54f3cc537b00c525fb4d004a604fff8397d5b547bf5a7be832ee30e"
    },
    {
      "path": ".agents/skills/ishiku-github-release/SKILL.md",
      "sha256": "f7ee5b0d25798d32749808a10d5e62fbb48e3273a7030e6b1bc180ae9f134dd0"
    },
    {
      "path": ".agents/skills/ishiku-modernize-app/agents/openai.yaml",
      "sha256": "4a1d47008afd97bcec21108790bfd9c6aa50cf4a58b9596d8ce232ff927bbfba"
    },
    {
      "path": ".agents/skills/ishiku-modernize-app/SKILL.md",
      "sha256": "a62d0eba8df603b244e20f244b1c5947058fd5f81ca02eafacac863f7d214f6e"
    },
    {
      "path": ".agents/skills/ishiku-new-app/agents/openai.yaml",
      "sha256": "c7ecb85ae479949310fe028d3e93c4c0464c7a18cdf9fec67930805d48ab5e13"
    },
    {
      "path": ".agents/skills/ishiku-new-app/SKILL.md",
      "sha256": "7cbdca648577367895b526ed66f9a79afdbf66641be08407fe54e76b345acb89"
    },
    {
      "path": ".agents/skills/ishiku-orchestrator/agents/openai.yaml",
      "sha256": "e7c5ef9f9f6a4eb34603ff271e873866505fe76210fdb7894b9ce9435ee88dca"
    },
    {
      "path": ".agents/skills/ishiku-orchestrator/SKILL.md",
      "sha256": "a20b7b3814fdd74d708d1932c6fafb95358b66e654cc7d47ab1c956e5fc113d9"
    },
    {
      "path": ".agents/skills/ishiku-project-analysis/agents/openai.yaml",
      "sha256": "91154a6546ecd77958f49f9b66576ac0ffb6c380c6d13fcc50b299cf4433b1b6"
    },
    {
      "path": ".agents/skills/ishiku-project-analysis/SKILL.md",
      "sha256": "2a9b2a543a142f50c3a5464c8063a366282730389b297648897f6579ba0a7370"
    },
    {
      "path": ".agents/skills/ishiku-security-review/agents/openai.yaml",
      "sha256": "c9619a53afe150f10d7c83aaa13c2009b5370acb7d262dfad7660a7eab9eaa5e"
    },
    {
      "path": ".agents/skills/ishiku-security-review/SKILL.md",
      "sha256": "e818bcbccbe16ee2e708dc4503d5746e5503b3d55c316936c49d0fb56f0c8061"
    },
    {
      "path": ".agents/skills/ishiku-test-engineer/agents/openai.yaml",
      "sha256": "f6c1903ee15030c221b8224ca82a21b6cc07ebbc7eb22813e8e88ff388bd5095"
    },
    {
      "path": ".agents/skills/ishiku-test-engineer/SKILL.md",
      "sha256": "db0cd4f6fe6781439bb2676cf4ff32a8c0263866f779139445fe50c7ec69380e"
    },
    {
      "path": ".agents/skills/ishiku-upstream-maintenance/agents/openai.yaml",
      "sha256": "e3c10f092098edd602575e42ebac7444540cbe9d66767d5e601e70ff875bd24e"
    },
    {
      "path": ".agents/skills/ishiku-upstream-maintenance/SKILL.md",
      "sha256": "7afbd4a629cafef43c1a67f897cf70a01b21b5bafbd166c01f82e62b0f7ba4d5"
    },
    {
      "path": ".github/workflows/ishiku-pull-request-verify.yml",
      "sha256": "87e0ea5002f38cc379e04e941dcdeb4a5e041f0d5eaddc906368ad40eb7c7912"
    },
    {
      "path": ".github/workflows/ishiku-release-release.yml",
      "sha256": "63f0e2f2fa29bb106fb2ad19f1070f454a5130118594d7b54e879dcfd411d0d9"
    },
    {
      "path": ".github/workflows/ishiku-soak-test-soak-test.yml",
      "sha256": "23861737c6ebc9bd7aed8a68511fa5a88f2686de0c916fe37a92359ce398f2ef"
    },
    {
      "path": ".github/workflows/ishiku-upstream-update-upstream-update.yml",
      "sha256": "a2d6630c1c13ee2e073f50b5ece4706369032db83969b10a5073580372978916"
    },
    {
      "path": ".ishiku/kit/platform.yaml",
      "sha256": "ed0881caa4a50a92f72679e8b7d3abcf1a80cda389461eb7961b412e3fad96fc"
    },
    {
      "path": ".ishiku/kit/policies/architecture.md",
      "sha256": "2fcf85b24b459c7bbb903bd363a409ab6f316fad3d4b05fb7ab0078ff4a775a6"
    },
    {
      "path": ".ishiku/kit/policies/definition-of-done.md",
      "sha256": "043c62026cb99d26572c5e4ee6e07bd057c296d17fa788ad3304f5a4ce67e4f3"
    },
    {
      "path": ".ishiku/kit/policies/dependencies.yaml",
      "sha256": "ff462294b11e5565a7a5ba624d4f6ee8966057c977b3cb721aa405e0a93b63fb"
    },
    {
      "path": ".ishiku/kit/policies/releases.md",
      "sha256": "d6216aefcaf6c7ffdc5c34728dcb9813d4be3cb2dbd9debe5b4cb9bc23e8c5ae"
    },
    {
      "path": ".ishiku/kit/policies/security.md",
      "sha256": "3ba0c36e5d9848dd3d4aac9e9e5dac4576de00309d1043418b65e82981da01b8"
    },
    {
      "path": ".ishiku/kit/policies/testing.md",
      "sha256": "413d7b524f0cad4e24e10fa56d143230e89f492cf8890710a645b00a0651e6d8"
    },
    {
      "path": ".ishiku/kit/schemas/appspec.schema.json",
      "sha256": "700a25eb02ce8648dce9dfe0fcb837f593b90363de629d141ed8330e03178bfd"
    },
    {
      "path": ".ishiku/kit/schemas/kit-manifest.schema.json",
      "sha256": "c6025b19a9708f9ed16350f10a2c58b824dce9e6af8d25f4e45895d28f120fb0"
    },
    {
      "path": ".ishiku/kit/schemas/override.schema.json",
      "sha256": "2bf3477513a1498cc06667f49f8837c7ab6a4d82f53da3d22a7dca137706c1b1"
    },
    {
      "path": ".ishiku/kit/schemas/platform.schema.json",
      "sha256": "26f0613e64774fa93baea59efede2cdef24e6dbef72a4be765d89d13a3d92e61"
    },
    {
      "path": ".ishiku/kit/schemas/project.schema.json",
      "sha256": "9ebb5530b45e6b65277ca4a82b95dd9a018fcd8cbbc5e5e7f833cb57d69db14d"
    },
    {
      "path": ".ishiku/kit/schemas/traceability.schema.json",
      "sha256": "183b13d7be1fe691f7cb155385e9ece1e2bbe4dc2f6da3d34aeb98c2f9902b1b"
    },
    {
      "path": ".ishiku/kit/schemas/workspace.schema.json",
      "sha256": "d3612558e48f432f7a808d192587dc19dd678dc9454e019e7bb95f7fb8a43e2e"
    },
    {
      "path": ".ishiku/kit/scripts/check-appspec",
      "sha256": "534091ddbaafa01fb6df4bd0c7dc48b3350262ac61d9aac2c9acb61dca52948b"
    },
    {
      "path": ".ishiku/kit/scripts/check-architecture",
      "sha256": "8980c870fe907c0ff1dd16ebcd3631232984ddabf2b132bad66e5c67d9ca0c41"
    },
    {
      "path": ".ishiku/kit/scripts/check-dependencies",
      "sha256": "6febbb980afc4c2ef8bb0e14fd1d8fd094eac4fc447fe587b8dc04fba4362dbd"
    },
    {
      "path": ".ishiku/kit/scripts/check-design",
      "sha256": "2427e3118d64908df5975edd3a71f9d0d115864128ad6a3b3a75f9551cd963df"
    },
    {
      "path": ".ishiku/kit/scripts/check-release",
      "sha256": "43febac2f607084a58c8a277bd78e28aed30f4142032e9bf67766325c6ddd765"
    },
    {
      "path": ".ishiku/kit/scripts/check-requirements",
      "sha256": "e2b9bef6af4edb6571caf707cd36ce5a63f62e204b850b87bea06a3cf5827fcd"
    },
    {
      "path": ".ishiku/kit/scripts/check-security",
      "sha256": "9cf52298ca01c2b6c7b60fed44fd521f9e321a6641f215c13f1151d44e67962f"
    },
    {
      "path": ".ishiku/kit/scripts/compliance-test",
      "sha256": "60ae15ce55597270ee588ab24918780b49032529b9a16b9496d9f0a1169c443b"
    },
    {
      "path": ".ishiku/kit/scripts/generate-traceability",
      "sha256": "a92a44483fa326cc0b9189222e3fdee52919545a8ccf4355207966cb313a1c1a"
    },
    {
      "path": ".ishiku/kit/scripts/ishiku.mjs",
      "sha256": "74c1790e1bcbda4b3395cd4c75fd461f228473cd0337b7c8e3f217aec4cbdf71"
    },
    {
      "path": ".ishiku/kit/scripts/soak-test",
      "sha256": "e18cdad31a06271461929407eebc779d0d0a7f2f409e045d48cae895fadf219f"
    },
    {
      "path": ".ishiku/kit/scripts/verify-app",
      "sha256": "d9e838b9de14f441754e930055764036e29d68a8ff1cbb2889b2d778427e3814"
    },
    {
      "path": ".ishiku/kit/version.yaml",
      "sha256": "2cb7d50e1c34ae5e9f22716fde8b6d53f2defb64329c913c2a8834a616742a9c"
    }
  ],
  "application_owned": [
    "AGENTS.md",
    "appspec.yaml",
    ".ishiku/project.yaml",
    ".ishiku/requirements/",
    ".ishiku/decisions/"
  ],
  "generated": [
    ".ishiku/reports/"
  ],
  "allowed_overrides": [
    ".ishiku/overrides/"
  ],
  "local_changes": []
}
